{
  "warrant_id": "01HZZZEXAMPLEWARRANT0001",
  "issued_at": "2026-02-24T00:00:00Z",
  "expires_at": "2026-02-24T00:10:00Z",
  "issuer": "tv.warrant.github.ci",
  "subject": {
    "type": "workflow_run",
    "id": "github:StegVerse-Labs/StegAgents:agents.yml:1234567890",
    "notes": "CI-issued warrant for agent run"
  },
  "scope": {
    "action": "run_agent",
    "target": "GrantFinder-001",
    "module": "StegVerse-Labs/StegAgents",
    "permissions_intent": ["out:write", "net:read"]
  },
  "policy": {
    "bundle_sha256": "aaaaaaaaaaaaaaaaaaaaaaaaaaaaaaaaaaaaaaaaaaaaaaaaaaaaaaaaaaaaaaaa",
    "bundle_version": "1.0.0"
  },
  "claims": {
    "host_platform": "github",
    "repo": "StegVerse-Labs/StegAgents",
    "ref": "refs/heads/main",
    "commit_sha": "0123456789abcdef0123456789abcdef01234567",
    "run_id": "1234567890",
    "workflow": "agents.yml",
    "actor": "github-actions"
  },
  "signature": {
    "alg": "ed25519",
    "public_key_id": "tv.warrant.github.ci.ed25519.001",
    "sig_b64": "BASE64_SIGNATURE_PLACEHOLDER"
  }
}
